{
  "$schema": "./reference-corpus.schema.json",
  "schemaVersion": "1.2.0",
  "capturedAt": "2026-07-15",
  "datasetStatus": "mixed-lifecycle",
  "entryCount": 76,
  "statusCounts": {
    "candidate": 76,
    "scanned": 0,
    "promoted": 0,
    "retired": 0
  },
  "observationCatalog": "./reference-observations.json",
  "observationCount": 7,
  "scanOutcomeCatalog": "./reference-scan-outcomes.json",
  "scanOutcomeCount": 20,
  "methodology": {
    "scope": "A deliberately diverse public corpus spanning hospitality, editorial, luxury, agencies, SaaS, ecommerce, legal, finance, healthcare, data storytelling and spatial experiments.",
    "candidateMeaning": "Every hero and motion description is a research hypothesis, not a verified claim about the current live implementation.",
    "reachabilityMethod": "A redirect-following HTTP probe was run on 2026-07-15; it was not a browser render, interaction test or rights review.",
    "promotionRule": "A candidate may become scanned only after documented Playwright evidence across desktop, mobile and reduced-motion states plus completed human visual review; promotion additionally requires a reusable mechanic, original reconstruction guidance and an explicit publication-rights classification."
  },
  "rightsPolicy": {
    "publicData": [
      "source URLs",
      "derived taxonomy",
      "scan metadata",
      "abstracted mechanics",
      "original reconstruction guidance"
    ],
    "excludedData": [
      "third-party screenshots without permission",
      "third-party videos without permission",
      "copied production source code",
      "third-party fonts or brand assets",
      "private filesystem paths"
    ],
    "captureRule": "Raw third-party captures remain private unless publication rights are documented; public evidence uses links, permitted excerpts or original recreations.",
    "implementationRule": "Reproduce the mechanic with original code and licensed or original assets; never present copied third-party implementation or assets as repository-owned work."
  },
  "entries": [
    {
      "id": "ref-001",
      "title": "Son Daven",
      "sourceUrl": "https://sondaven.com",
      "status": "candidate",
      "industry": "hospitality and resort investment",
      "designLane": "cinematic-immersion",
      "heroMechanicHypothesis": "A loading prologue opens into a place-led mountain and architecture narrative.",
      "motionSignatureHypothesis": "Preloader progression, seasonal states, scroll chapters and image galleries.",
      "assetDependency": "high",
      "scanRisk": {
        "level": "medium",
        "reasons": ["long-form page", "media-heavy", "preloader state"]
      },
      "provenance": {
        "sourceType": "official-live-site",
        "observedAt": "2026-07-15",
        "reachability": "http-200",
        "notes": "Redirected to the Ukrainian locale during the reachability check.",
        "discoveryReferences": [
          {
            "url": "https://www.awwwards.com/websites/hotel-restaurant/",
            "relationship": "award-directory-category",
            "verification": "discovery-only"
          }
        ]
      },
      "scanPriority": "must-scan"
    },
    {
      "id": "ref-002",
      "title": "Salterra Resort & Spa",
      "sourceUrl": "https://www.salterra.com",
      "status": "candidate",
      "industry": "luxury hospitality",
      "designLane": "calm-luxury",
      "heroMechanicHypothesis": "Full-bleed coastal imagery establishes a quiet, high-value destination world.",
      "motionSignatureHypothesis": "Images appear to float toward center through scroll, sliders and restrained parallax.",
      "assetDependency": "high",
      "scanRisk": {
        "level": "medium",
        "reasons": ["large photography", "scroll effects", "booking context"]
      },
      "provenance": {
        "sourceType": "official-live-site",
        "observedAt": "2026-07-15",
        "reachability": "http-200",
        "discoveryReferences": [
          {
            "url": "https://www.awwwards.com/sites/salterra-resort-spa",
            "relationship": "award-site-profile",
            "verification": "discovery-only"
          }
        ]
      },
      "scanPriority": "must-scan"
    },
    {
      "id": "ref-003",
      "title": "Units",
      "sourceUrl": "https://units.gr",
      "status": "candidate",
      "industry": "hospitality and food",
      "designLane": "expressive-typography",
      "heroMechanicHypothesis": "A high-impact type and image takeover introduces the venue.",
      "motionSignatureHypothesis": "Loader, elastic reveals and strong scroll rhythm.",
      "assetDependency": "high",
      "scanRisk": {
        "level": "high",
        "reasons": ["verification wall", "automation challenge", "unknown post-challenge states"]
      },
      "provenance": {
        "sourceType": "official-live-site",
        "observedAt": "2026-07-15",
        "reachability": "http-200-challenge",
        "discoveryReferences": [
          {
            "url": "https://www.awwwards.com/websites/hotel-restaurant/",
            "relationship": "award-directory-category",
            "verification": "discovery-only"
          }
        ]
      },
      "scanPriority": "fallback"
    },
    {
      "id": "ref-004",
      "title": "Here & Away",
      "sourceUrl": "https://www.here-away.com",
      "status": "candidate",
      "industry": "travel discovery and hospitality commerce",
      "designLane": "archive-catalog",
      "heroMechanicHypothesis": "Rotating destinations connect editorial discovery with a searchable stay catalog.",
      "motionSignatureHypothesis": "Image swaps, filters, card transitions and travel-mood interactions.",
      "assetDependency": "high",
      "scanRisk": {
        "level": "medium",
        "reasons": ["large image catalog", "filters", "commerce states"]
      },
      "provenance": {
        "sourceType": "official-live-site",
        "observedAt": "2026-07-15",
        "reachability": "http-200",
        "discoveryReferences": [
          {
            "url": "https://www.awwwards.com/websites/hotel-restaurant/",
            "relationship": "award-directory-category",
            "verification": "discovery-only"
          }
        ]
      },
      "scanPriority": "must-scan"
    },
    {
      "id": "ref-005",
      "title": "The Bend Club",
      "sourceUrl": "https://www.thebendclub.com",
      "status": "candidate",
      "industry": "luxury residence club",
      "designLane": "calm-luxury",
      "heroMechanicHypothesis": "A river-led headline and landscape imagery frame a small premium residence concept.",
      "motionSignatureHypothesis": "Measured reveals and a morning-to-evening lifestyle montage.",
      "assetDependency": "high",
      "scanRisk": {
        "level": "low",
        "reasons": ["compact concept site"]
      },
      "provenance": {
        "sourceType": "official-live-site",
        "observedAt": "2026-07-15",
        "reachability": "http-200",
        "discoveryReferences": [
          {
            "url": "https://www.awwwards.com/websites/hotel-restaurant/",
            "relationship": "award-directory-category",
            "verification": "discovery-only"
          }
        ]
      },
      "scanPriority": "high"
    },
    {
      "id": "ref-006",
      "title": "Hotel Corazon",
      "sourceUrl": "https://hotelcorazon.com",
      "status": "candidate",
      "industry": "boutique hospitality",
      "designLane": "editorial-engine",
      "heroMechanicHypothesis": "Landscape and art are composed as an organic editorial collage.",
      "motionSignatureHypothesis": "Layered collage, tactile parallax and route-like story reveals.",
      "assetDependency": "high",
      "scanRisk": {
        "level": "high",
        "reasons": ["verification wall", "automation challenge"]
      },
      "provenance": {
        "sourceType": "official-live-site",
        "observedAt": "2026-07-15",
        "reachability": "http-200-challenge"
      },
      "scanPriority": "fallback"
    },
    {
      "id": "ref-007",
      "title": "Fogo Island Inn",
      "sourceUrl": "https://www.fogoislandinn.ca",
      "status": "candidate",
      "industry": "place-based hospitality",
      "designLane": "editorial-engine",
      "heroMechanicHypothesis": "Architecture is framed directly against remote landscape and local context.",
      "motionSignatureHypothesis": "Restrained fades, maps and story transitions preserve a documentary tone.",
      "assetDependency": "high",
      "scanRisk": {
        "level": "medium",
        "reasons": ["large photography", "multi-page content"]
      },
      "provenance": {
        "sourceType": "official-live-site",
        "observedAt": "2026-07-15",
        "reachability": "http-200"
      },
      "scanPriority": "high"
    },
    {
      "id": "ref-008",
      "title": "Aman",
      "sourceUrl": "https://www.aman.com",
      "status": "candidate",
      "industry": "global luxury hospitality",
      "designLane": "calm-luxury",
      "heroMechanicHypothesis": "A destination image or film carries a global luxury navigation system.",
      "motionSignatureHypothesis": "Slow crossfades, map states and restrained carousel movement.",
      "assetDependency": "high",
      "scanRisk": {
        "level": "medium",
        "reasons": ["geo state", "consent state", "large media"]
      },
      "provenance": {
        "sourceType": "official-live-site",
        "observedAt": "2026-07-15",
        "reachability": "http-200"
      },
      "scanPriority": "standard"
    },
    {
      "id": "ref-009",
      "title": "Waldhaus Sils",
      "sourceUrl": "https://www.waldhaus-sils.ch",
      "status": "candidate",
      "industry": "heritage hospitality",
      "designLane": "editorial-engine",
      "heroMechanicHypothesis": "Alpine history and hospitality are introduced through an archival visual frame.",